{
  "generated_at": "2026-07-30T21:57:52.952452+00:00",
  "nav": {
    "groups": [
      {
        "name": "Core",
        "tabs": [
          {
            "kind": "wired",
            "name": "Overview",
            "path": "/mission/overview",
            "slug": "overview"
          },
          {
            "kind": "wired",
            "name": "Chat",
            "path": "/mission/chat",
            "slug": "chat"
          },
          {
            "kind": "wired",
            "name": "Canvas (OpenUI)",
            "path": "/mission/canvas-openui",
            "slug": "canvas-openui"
          },
          {
            "kind": "wired",
            "name": "Sessions",
            "path": "/mission/sessions",
            "slug": "sessions"
          }
        ]
      },
      {
        "name": "Observability",
        "tabs": [
          {
            "kind": "wired",
            "name": "Traces",
            "path": "/mission/traces",
            "slug": "traces"
          },
          {
            "kind": "wired",
            "name": "Audit & Analytics",
            "path": "/mission/audit-analytics",
            "slug": "audit-analytics"
          },
          {
            "kind": "wired",
            "name": "Providers & LLMs",
            "path": "/mission/providers-llms",
            "slug": "providers-llms"
          },
          {
            "kind": "wired",
            "name": "Budget & Cost",
            "path": "/mission/budget-cost",
            "slug": "budget-cost"
          },
          {
            "kind": "wired",
            "name": "Channels",
            "path": "/mission/channels",
            "slug": "channels"
          },
          {
            "kind": "wired",
            "name": "Sub-agents",
            "path": "/mission/sub-agents",
            "slug": "sub-agents"
          },
          {
            "kind": "wired",
            "name": "Alerts & Logs",
            "path": "/mission/alerts-logs",
            "slug": "alerts-logs"
          }
        ]
      },
      {
        "name": "Agent",
        "tabs": [
          {
            "kind": "wired",
            "name": "Agent Config",
            "path": "/mission/agent-config",
            "slug": "agent-config"
          },
          {
            "kind": "wired",
            "name": "Model Params",
            "path": "/mission/model-params",
            "slug": "model-params"
          },
          {
            "kind": "wired",
            "name": "Tools & Permissions",
            "path": "/mission/tools-permissions",
            "slug": "tools-permissions"
          },
          {
            "kind": "wired",
            "name": "Skills",
            "path": "/mission/skills",
            "slug": "skills"
          },
          {
            "kind": "wired",
            "name": "MCP Servers",
            "path": "/mission/mcp-servers",
            "slug": "mcp-servers"
          },
          {
            "kind": "wired",
            "name": "Coding Agents",
            "path": "/mission/coding-agents",
            "slug": "coding-agents"
          }
        ]
      },
      {
        "name": "Knowledge",
        "tabs": [
          {
            "kind": "wired",
            "name": "Memory",
            "path": "/mission/memory",
            "slug": "memory"
          },
          {
            "kind": "wired",
            "name": "Second Brain",
            "path": "/mission/second-brain",
            "slug": "second-brain"
          },
          {
            "kind": "wired",
            "name": "Workspace Files",
            "path": "/mission/workspace-files",
            "slug": "workspace-files"
          },
          {
            "kind": "wired",
            "name": "Code Understanding",
            "path": "/mission/code-understanding",
            "slug": "code-understanding"
          }
        ]
      },
      {
        "name": "Self-improve",
        "tabs": [
          {
            "kind": "wired",
            "name": "Jobs",
            "path": "/mission/jobs",
            "slug": "jobs"
          },
          {
            "kind": "wired",
            "name": "Trajectories",
            "path": "/mission/trajectories",
            "slug": "trajectories"
          },
          {
            "kind": "wired",
            "name": "Feedback",
            "path": "/mission/feedback",
            "slug": "feedback"
          },
          {
            "kind": "wired",
            "name": "RLM Config",
            "path": "/mission/rlm-training",
            "slug": "rlm-training"
          },
          {
            "kind": "wired",
            "name": "Experiments & Metrics",
            "path": "/mission/experiments-metrics",
            "slug": "experiments-metrics"
          }
        ]
      },
      {
        "name": "Evolution",
        "tabs": [
          {
            "kind": "wired",
            "name": "Issues",
            "path": "/mission/issues",
            "slug": "issues"
          },
          {
            "kind": "wired",
            "name": "Pipelines",
            "path": "/mission/pipelines",
            "slug": "pipelines"
          },
          {
            "kind": "wired",
            "name": "Approvals",
            "path": "/mission/approvals",
            "slug": "approvals"
          },
          {
            "kind": "wired",
            "name": "Spec-Kit",
            "path": "/mission/spec-kit",
            "slug": "spec-kit"
          },
          {
            "kind": "wired",
            "name": "Evolution Traces",
            "path": "/mission/evolution-traces",
            "slug": "evolution-traces"
          },
          {
            "kind": "wired",
            "name": "Stats",
            "path": "/mission/stats",
            "slug": "stats"
          }
        ]
      },
      {
        "name": "Ops",
        "tabs": [
          {
            "kind": "wired",
            "name": "Cron",
            "path": "/mission/cron",
            "slug": "cron"
          },
          {
            "kind": "wired",
            "name": "Security",
            "path": "/mission/security",
            "slug": "security"
          },
          {
            "kind": "wired",
            "name": "Secrets",
            "path": "/mission/secrets",
            "slug": "secrets"
          },
          {
            "kind": "wired",
            "name": "Egress proxy",
            "path": "/mission/egress-proxy",
            "slug": "egress-proxy"
          },
          {
            "kind": "wired",
            "name": "Tunnels & Infra",
            "path": "/mission/tunnels-infra",
            "slug": "tunnels-infra"
          },
          {
            "kind": "wired",
            "name": "Backup & Snapshots",
            "path": "/mission/backup-snapshots",
            "slug": "backup-snapshots"
          },
          {
            "kind": "wired",
            "name": "Config",
            "path": "/mission/config",
            "slug": "config"
          },
          {
            "kind": "wired",
            "name": "Schema & Ontology",
            "path": "/mission/schema-ontology",
            "slug": "schema-ontology"
          },
          {
            "kind": "wired",
            "name": "sevn CLI",
            "path": "/mission/sevn-cli",
            "slug": "sevn-cli"
          },
          {
            "kind": "wired",
            "name": "Terminal",
            "path": "/mission/terminal",
            "slug": "terminal"
          }
        ]
      },
      {
        "name": "Surfaces",
        "tabs": [
          {
            "kind": "wired",
            "name": "Telegram Menu",
            "path": "/mission/telegram-menu",
            "slug": "telegram-menu"
          },
          {
            "kind": "wired",
            "name": "Web Apps",
            "path": "/mission/web-apps",
            "slug": "web-apps"
          },
          {
            "kind": "wired",
            "name": "Onboarding",
            "path": "/mission/onboarding",
            "slug": "onboarding"
          },
          {
            "kind": "wired",
            "name": "Users & RBAC",
            "path": "/mission/users-rbac",
            "slug": "users-rbac"
          }
        ]
      }
    ],
    "post_v1_placeholder_slugs": [],
    "tab_count": 46,
    "tabs": [
      {
        "group": "Core",
        "name": "Overview",
        "path": "/mission/overview",
        "slug": "overview"
      },
      {
        "group": "Core",
        "name": "Chat",
        "path": "/mission/chat",
        "slug": "chat"
      },
      {
        "group": "Core",
        "name": "Canvas (OpenUI)",
        "path": "/mission/canvas-openui",
        "slug": "canvas-openui"
      },
      {
        "group": "Core",
        "name": "Sessions",
        "path": "/mission/sessions",
        "slug": "sessions"
      },
      {
        "group": "Observability",
        "name": "Traces",
        "path": "/mission/traces",
        "slug": "traces"
      },
      {
        "group": "Observability",
        "name": "Audit & Analytics",
        "path": "/mission/audit-analytics",
        "slug": "audit-analytics"
      },
      {
        "group": "Observability",
        "name": "Providers & LLMs",
        "path": "/mission/providers-llms",
        "slug": "providers-llms"
      },
      {
        "group": "Observability",
        "name": "Budget & Cost",
        "path": "/mission/budget-cost",
        "slug": "budget-cost"
      },
      {
        "group": "Observability",
        "name": "Channels",
        "path": "/mission/channels",
        "slug": "channels"
      },
      {
        "group": "Observability",
        "name": "Sub-agents",
        "path": "/mission/sub-agents",
        "slug": "sub-agents"
      },
      {
        "group": "Observability",
        "name": "Alerts & Logs",
        "path": "/mission/alerts-logs",
        "slug": "alerts-logs"
      },
      {
        "group": "Agent",